{"schema_version":"1.0","adapter_version":"1.0","status":"PARTIAL","generated_at":"2026-09-10T18:34:42+09:00","snapshot_generated_at":"2026-09-04T07:27:42+09:00","as_of":"2026-09-03","scope":"主要500+Growth","declared_count":964,"candidate_count":964,"output_count":3,"limit":3,"benchmark_source":"1306 TOPIX連動ETF（Yahoo Finance）","versions":{"logic_version":"2026.09-v8-quarterly-earnings","strategy_version":null,"threshold_version":null,"status":"UNVERIFIED"},"input_hashes":{"snapshot":"9f834d027b8ebf7654a96888eb7309f666b487ece2485726f686308dfa4858be","details":{"7371":"eacb08c99f7cc294a19a8963438877f88fe7487a5904b8c72b69ef17c227950e","8876":"69489e9d3f3d7b3839e9d642a9fa31df4c5fe7c15ddb1874996b5e7fb02710a1","8341":"58232e7f14bdeead0d5bbb9366d79f5861202776982afe16602f2d7fce4c1843"},"config":"f857df45a798165c632ecb27e950fccc2685e605ba203b54b62d7c99349c4ff2"},"definitions":{"rank":"snapshot全候補内の1始まり順位。再ランキングなし。","close":"円。調整済み日足終値。リアルタイム価格ではない。","analysis_date":"銘柄別detail.as_of。全体as_ofや生成日時とは別。","aligned_count":"5手法のBREAKOUT/WATCH/SETUP FORMING数。Confluenceとは別。","breakout_count":"5手法中BREAKOUT数。Connorsは分母に含めない。","confluence":"既存Coreの総合合致数。Adapterでは再評価しない。","pivot_distance_pct":"(pivot/close-1)*100。正ならPivotが終値より上。%単位。","risk_per_share":"max(entry_low,min(close,entry_high))-stop。円/株。前提確認可能時のみ。","trade_plan":"entry/stop/targetは円。既存の参考価格。実現利益や注文ではない。","momentum_percentile":"分析母集団内の6か月騰落率percentile。0～100。","trading_value":"円。終値×出来高の概算。20本平均は当日を含む。","trading_value_ratio":"当日概算売買代金/当日を含む20本平均。倍。","volume_ratio":"当日出来高/当日を含む20本平均。倍。Core条件値由来。","coverage":"6手法の条件非N/A率。%。市場カバー率ではない。","confidence":"既存条件品質指標。利益確率ではない。","pivot_fidelity":"最寄りPivotの品質。consensus_pivot_fidelityとは別。","conditions":"既存評価の観測結果。○/△/×/N/Aを保持。原票の全履歴は含まない。","provenance":"hashは入力再現用。同run生成の証明ではない。SAME_JOB_ATTESTEDは呼出元の保証。"},"issues":[{"field":"snapshot","reason":"UPSTREAM_ERRORS_REPORTED"},{"field":"versions","reason":"VERSION_UNVERIFIED"}],"stocks":[{"rank":1,"code":"7371","close":815.0,"aligned_count":5,"breakout_count":5,"confluence":0,"pivot":780.0,"momentum_percentile":78.42323651452283,"avg_trading_value_20d":18574630.0,"current_trading_value":25591000.0,"trading_value_ratio":1.377739421996562,"coverage":90.0,"name":"Ｚｅｎｋｅｎ","pivot_type":"VCP Final Contraction","pivot_basis":"Structure","pivot_fidelity":"PRACTICAL","consensus_pivot_fidelity":"PRACTICAL","confidence":"MEDIUM","consensus_state":"BREAKOUT","liquidity_state":"VERY LOW","source":"Yahoo Finance (補完・非公式)","analysis_date":"2026-09-03","date_status":"MATCHES_SNAPSHOT","liquid":false,"pivot_distance_pct":-4.294478527607359,"trade_plan":{"status":"指値待機","basis":"最寄りPivot突破から+2%までの低リスク帯","warning":"","entry_zone_low":780.0,"entry_zone_high":795.6,"stop":744.0,"target_1r":847.2,"target_2r":898.8000000000001,"risk_per_share":null},"strategies":{"Minervini":{"state":"BREAKOUT","conditions":[{"key":"price_ma50","label":"株価 > 50日移動平均","verdict":"○","role":"REQUIRED","layer":"Market / Trend","unit":"円","fidelity":"STRICT","note":"","value":815.0,"reference":741.0105383300781},{"key":"price_ma150","label":"株価 > 150日移動平均","verdict":"○","role":"REQUIRED","layer":"Market / Trend","unit":"円","fidelity":"STRICT","note":"","value":815.0,"reference":697.9031909179688},{"key":"price_ma200","label":"株価 > 200日移動平均","verdict":"○","role":"REQUIRED","layer":"Market / Trend","unit":"円","fidelity":"STRICT","note":"","value":815.0,"reference":685.5936306762695},{"key":"ma50_ma150","label":"50日MA > 150日MA","verdict":"○","role":"REQUIRED","layer":"Market / Trend","unit":"円","fidelity":"STRICT","note":"","value":741.0105383300781,"reference":697.9031909179688},{"key":"ma150_ma200","label":"150日MA > 200日MA","verdict":"○","role":"REQUIRED","layer":"Market / Trend","unit":"円","fidelity":"STRICT","note":"","value":697.9031909179688,"reference":685.5936306762695},{"key":"ma200_rising","label":"200日MAが1か月前より上向き","verdict":"○","role":"REQUIRED","layer":"Market / Trend","unit":"%","fidelity":"PRACTICAL","note":"","value":1.872477675201356,"reference":0},{"key":"above_52w_low","label":"52週安値から30%以上上昇","verdict":"○","role":"REQUIRED","layer":"Stock Quality / Momentum","unit":"%","fidelity":"STRICT","note":"","value":35.54105987297922,"reference":30},{"key":"near_52w_high","label":"52週高値から25%以内","verdict":"○","role":"REQUIRED","layer":"Stock Quality / Momentum","unit":"%","fidelity":"STRICT","note":"","value":1.0922330097087378,"reference":25},{"key":"rs","label":"市場内Relative Strength上位","verdict":"○","role":"SUPPORTING","layer":"Stock Quality / Momentum","unit":"percentile","fidelity":"PROXY","note":"市場内複合モメンタム順位をRS Ratingの代理に使用","value":78.42323651452283,"reference":70},{"key":"vcp","label":"値幅が段階的に収縮","verdict":"○","role":"SUPPORTING","layer":"Entry Setup","unit":"%","fidelity":"PROXY","note":"60/30/15日のレンジ幅による機械判定","value":"18.3 → 14.3 → 12.2","reference":"収縮"},{"key":"pivot","label":"VCP Pivotまで3%以内","verdict":"×","role":"TRIGGER","layer":"Entry Setup","unit":"%","fidelity":"PRACTICAL","note":"","value":-4.294478527607359,"reference":3}]},"Qullamaggie":{"state":"BREAKOUT","conditions":[{"key":"momentum3","label":"3か月で大きく上昇","verdict":"△","role":"REQUIRED","layer":"Stock Quality / Momentum","unit":"%","fidelity":"PRACTICAL","note":"","value":20.998027852192934,"reference":30},{"key":"momentum6","label":"6か月Momentum","verdict":"×","role":"SUPPORTING","layer":"Stock Quality / Momentum","unit":"%","fidelity":"PRACTICAL","note":"","value":15.701261964627689,"reference":50},{"key":"trend","label":"株価 > 50日MA > 150日MA","verdict":"○","role":"REQUIRED","layer":"Market / Trend","unit":"円","fidelity":"PRACTICAL","note":"","value":"815 > 741 > 698","reference":null},{"key":"contraction","label":"上昇後のレンジ収縮","verdict":"○","role":"REQUIRED","layer":"Entry Setup","unit":"%","fidelity":"PROXY","note":"","value":"18.3 → 14.3 → 12.2","reference":"縮小"},{"key":"dryup","label":"出来高Dry-up","verdict":"×","role":"SUPPORTING","layer":"Entry Setup","unit":"倍","fidelity":"PROXY","note":"","value":1.304257528556594,"reference":0.65},{"key":"pivot_distance","label":"Consolidation Pivot付近","verdict":"×","role":"TRIGGER","layer":"Entry Setup","unit":"%","fidelity":"PROXY","note":"","value":-4.294478527607359,"reference":3},{"key":"volume_expansion","label":"突破イベント時の出来高増加","verdict":"×","role":"TRIGGER","layer":"Entry Setup","unit":"倍","fidelity":"PRACTICAL","note":"","value":1.304257528556594,"reference":1.5}]},"CAN SLIM":{"state":"BREAKOUT","conditions":[{"key":"current_earnings","label":"C: 直近EPS成長","verdict":"N/A","role":"REQUIRED","layer":"Stock Quality / Momentum","unit":"%","fidelity":"PRACTICAL","note":"","value":null,"reference":25},{"key":"sales","label":"売上高成長","verdict":"N/A","role":"SUPPORTING","layer":"Stock Quality / Momentum","unit":"%","fidelity":"PRACTICAL","note":"","value":null,"reference":20},{"key":"annual_earnings","label":"A: 年次EPS成長","verdict":"N/A","role":"REQUIRED","layer":"Stock Quality / Momentum","unit":"","fidelity":"PRACTICAL","note":"年次EPS履歴が不足（0/3期）。Coverageへ反映。 原因: EDINET_NOT_FOUND","value":null,"reference":"3期以上"},{"key":"new","label":"N: 新製品・新経営・新高値","verdict":"○","role":"SUPPORTING","layer":"Stock Quality / Momentum","unit":"%","fidelity":"PROXY","note":"新高値接近度のみを代理使用","value":1.0922330097087378,"reference":5},{"key":"rs","label":"L: 市場リーダー候補","verdict":"△","role":"REQUIRED","layer":"Stock Quality / Momentum","unit":"percentile","fidelity":"PROXY","note":"","value":78.42323651452283,"reference":80},{"key":"institutional","label":"I: Institutional Sponsorship","verdict":"N/A","role":"SUPPORTING","layer":"Stock Quality / Momentum","unit":"","fidelity":"STRICT","note":"日本株で一貫した保有増減データを取得できないためN/A","value":null,"reference":null},{"key":"market","label":"M: 市場トレンドが良好","verdict":"○","role":"REQUIRED","layer":"Market / Trend","unit":"","fidelity":"PRACTICAL","note":"","value":"STRONG BULL","reference":"BULL以上"},{"key":"base_breakout","label":"Base上限付近／突破イベント","verdict":"×","role":"TRIGGER","layer":"Entry Setup","unit":"%","fidelity":"PRACTICAL","note":"","value":-4.294478527607359,"reference":3}]},"Weinstein":{"state":"BREAKOUT","conditions":[{"key":"price_ma","label":"株価が30週MA相当より上","verdict":"○","role":"REQUIRED","layer":"Market / Trend","unit":"円","fidelity":"PRACTICAL","note":"","value":815.0,"reference":697.9031909179688},{"key":"ma_slope","label":"30週MA相当が上向き","verdict":"○","role":"REQUIRED","layer":"Market / Trend","unit":"%/20日","fidelity":"PRACTICAL","note":"","value":2.123044953809927,"reference":0},{"key":"ma_order","label":"中期トレンド整列","verdict":"○","role":"SUPPORTING","layer":"Market / Trend","unit":"円","fidelity":"PROXY","note":"","value":"741/698/686","reference":null},{"key":"rs","label":"市場対比で優位","verdict":"○","role":"SUPPORTING","layer":"Stock Quality / Momentum","unit":"%","fidelity":"PRACTICAL","note":"","value":8.790283488525086,"reference":0},{"key":"stage2_breakout","label":"Stage 1抵抗線付近／突破","verdict":"×","role":"TRIGGER","layer":"Entry Setup","unit":"%","fidelity":"PRACTICAL","note":"","value":-4.294478527607359,"reference":3}]},"Darvas":{"state":"BREAKOUT","conditions":[{"key":"high_zone","label":"52週高値圏","verdict":"○","role":"REQUIRED","layer":"Stock Quality / Momentum","unit":"円","fidelity":"PRACTICAL","note":"","value":815.0,"reference":824.0},{"key":"box_width","label":"Boxの値幅が限定","verdict":"○","role":"REQUIRED","layer":"Entry Setup","unit":"%","fidelity":"PRACTICAL","note":"","value":6.8493150684931505,"reference":15},{"key":"floor","label":"Box下限が維持","verdict":"○","role":"REQUIRED","layer":"Entry Setup","unit":"円","fidelity":"PRACTICAL","note":"","value":815.0,"reference":730.0},{"key":"top","label":"Box Top付近／突破","verdict":"×","role":"TRIGGER","layer":"Entry Setup","unit":"%","fidelity":"PRACTICAL","note":"","value":-4.294478527607359,"reference":3},{"key":"volume","label":"突破イベント時の出来高増加","verdict":"×","role":"SUPPORTING","layer":"Entry Setup","unit":"倍","fidelity":"PRACTICAL","note":"","value":1.304257528556594,"reference":1.3}]},"Connors":{"state":"EXTENDED","conditions":[{"key":"long_trend","label":